{"admission_authorized":false,"arm":{"id":"flash-unissued","label":"Mia Flash-Next — unissued after runtime gate","role_map":{"capability":"flash","system_actor":"flash","system_critic":"flash"},"routes":{"flash":{"backend":"supervised-flash-endpoint","expected_policy":{"reasoning_effort":null,"sampling_extra":{"chat_template_kwargs":{"enable_thinking":false}},"temperature":0.0,"top_p":1.0},"model":"qwen3.8-flash-next-mia","profile":"deterministic_off","runtime_identity":{"artifact_sha256":"a40ce50173dd3aff54da88503894967e5248bbb927f9e4a91eff5a6a7270c168","max_context_tokens":32768,"runtime_sha256":"cd2568e650bfd9fab72f573e81db15eb5f10c2822999b578b0e570615978931b","served_model":"qwen3.8-flash-next-mia"}}},"seed":17},"comparison_id":"stable-benchmark-v1-1-20260916-a","definition_sha256":"d2eb69d9c0fefc7b377cec6cb550f491979a5f137d38346dc99a607be5890006","harness_identity":{"scaffold_id":"stable-benchmark-runner-v1","source_sha256":{"agent_wrapper/__init__.py":"e3b0c44298fc1c149afbf4c8996fb92427ae41e4649b934ca495991b7852b855","agent_wrapper/backends/__init__.py":"89c9f1354a945de9b176263f64b8b696112680e077b3cb57c8d2c22242a0d29a","agent_wrapper/backends/anthropic.py":"dda35f505c847202590e43cd7c66efc799d8646f58bae6ae2cc73dae493a655a","agent_wrapper/backends/base.py":"e2cda27db6e577c4952bdc62be33e93795424b0dbcec61a4a0acd1de8dd47055","agent_wrapper/backends/ollama_openai.py":"cde8196436f22b05f12bef0ccf491a54030ff13b83149c5542b67d3ac8584e67","agent_wrapper/backends/qwen_vllm.py":"a5dc9a4ea5071dfcbd263bd2247fe1a8e0ae8fe4f5e791a2b27b1e694eef9739","agent_wrapper/backends/vllm_openai.py":"b8c73d2351f807ef825c90f7fa761a2f1c8d32589e64836f0fe1e8b39b84eb8e","agent_wrapper/generation_policy.py":"3a45aa1303bb0f53fe73533b9750b07049acf3c0a0eaa4107582812f5db449a5","agent_wrapper/upgrade_lease.py":"3df940550f66c8b8f628b141a3b45c40ae4bd61c960b383e3be61969943dea07","agent_wrapper/worker_activity.py":"30fa1b422a16b705dc698fe908b68d74dae095105021d2183ac4514180521efc","agent_wrapper/wrapper.py":"5ee8746587c7ab4e3bc77e317c8d586c7371341ad7f610444b10d25136d4ed0c","bench/stable_benchmark/__init__.py":"6be0e85aaa81bac66099aa6ca4c3c6b53375a6928a98703541f3e5aed2afe7c6","bench/stable_benchmark/fixtures.py":"e814fd805864055bfff10b1525af59dbae678f86dbc3bd4336f03ba877bd2d0f","bench/stable_benchmark/graders.py":"66068fb055b3d9cb0431e037bde29b4b6180dae3b0e74455e06071aba1ef961d","bench/stable_benchmark/manifest.py":"4566688c3de7193544f29cd0be55ec780bea0bd3e0defe080132c0da7ae34a57","bench/stable_benchmark/runner.py":"81efee388d2fac34fef3da41dfa9fde5b8ed29836a462b444b90e9f174986c39","bench/weekly_upgrade_portfolio/code_sandbox.py":"db611859025f05344af0b6c1ce741d94bb3165355624a09995147189c6210983","schema/calls.jsonl.schema.json":"fca1c282e1c626c8b8403aaa5048c4d076b2db90eb7a2dbf04d4020e2739a77b"},"transport_contract":"injected-supervised-endpoint/v1"},"ordering":"frozen_definition_order","release":"1.1.0","resource_envelope":{"execution":"serial_one_spark","max_episode_runtime_s_per_arm":1575,"max_model_calls_paired":58,"max_model_calls_per_arm":29,"max_output_tokens_per_arm":25088,"max_supervised_window_s":7200,"paid_api_cost_usd":0},"schema_version":"stable-benchmark-run-manifest/v1","suite_id":"a-bgt-rsi-stable-1.1.0","task_ids":["SCI-MARKOV-001","SCI-RCT-001","EVID-SUPPORT-001","EVID-ABSTAIN-001","CODE-MERGE-001","CODE-WEIGHTED-MEDIAN-001","CODE-DRAWDOWN-001","CODE-WATERFALL-001","TOOL-SINGLE-001","TOOL-PARALLEL-001","TOOL-NOCALL-001","TOOL-DEPENDENT-001","GAME-PUBLIC-GOODS-101","GAME-PUBLIC-GOODS-211","GAME-VICKREY-101","GAME-VICKREY-211","GAME-COURNOT-307","GAME-BRIER-401","SYSTEM-PAYOFF-001","SYSTEM-AUCTION-001","SYSTEM-EVIDENCE-001"]}
